### ISSUE TITLE
"Instrument is offline" or "Connection timeout error"?

### ISSUE THREAD

**Issue by zeeMonkeez** [dashesy/CereLink#47]
I'm having trouble testing cbsdk with testcbsdk. This is my setup: NSP (at 6.04), Windows PC with Central at `192.168.137.2`, linux machine with cbsdk at `192.168.137.47`. I've read https://github.com/dashesy/CereLink/issues/8 and followed suggestions to set `con.szInIP = "192.168.137.255";` or `255.255.255.255`, to no avail.
I can capture UDP packets coming in and going out, and the NSP seems to be upset (because it stops sending packets).

**Comment by dashesy** [comment]
Does it work with `nPlayServer`? Which distro is this? Also make sure the firewall lets udp pass.

**Comment by zeeMonkeez** [comment]
When I run `nPlayServer` on the windows machine (with `--network inst=192.168.137.2 --network bcast=192.168.137.255` and set `con.szOutIP = "192.168.137.2";` in `testcbsdk.cpp`, the connection seems to be successful. This is with Central not running on Windows and `cbSdkConnectionType conType = CBSDKCONNECTION_UDP;`.

When I shut down the NSP and restart it, its status changes through 'Standby' to 'Running' when I run `testcbsdk`.

**Comment by dashesy** [comment]
Even on Linux (email me to send you nPlayServer for Linux if you do not have one, or ask Blackrock support) you will not need to set IP addresses for nPlayServer, by default.

What is the distro (Fedora filters UDP)? what does ifconfig say about IP address of the network card? . Also, do you have any routers in between?

**Comment by zeeMonkeez** [comment]
There doesn't seem to be any firewall installed (and the fact that the UDP connections to the Windows machine are successful suggest UDP packets get out?).
`ifconfig` reports
```
eth0      Link encap:Ethernet  HWaddr xx:xx:xx:xx:xx:xx 
          inet addr:192.168.137.47  Bcast:192.168.137.255  Mask:255.255.255.0
```
There are no routers in between (just a switch).

This  is what `testcbsdk` sends out:
```
02:16:50.834556 IP 192.168.137.47.51002 > 192.168.137.128.51001: UDP, length 32
        0x0000:  4500 003c 59a9 4000 4011 4d07 c0a8 892f  E..<Y.@.@.M..../
        0x0010:  c0a8 8980 c73a c739 0028 943a 0100 0000  .....:.9.(.:....
        0x0020:  0080 9206 0800 0000 107f 0100 0000 0000  ................
        0x0030:  0000 0000 3200 0000 0000 0000            ....2.......
02:16:51.824489 IP 192.168.137.47.51002 > 192.168.137.128.51001: UDP, length 8
        0x0000:  4500 0024 59ad 4000 4011 4d1b c0a8 892f  E..$Y.@.@.M..../
        0x0010:  c0a8 8980 c73a c739 0010 9422 4c7b e602  .....:.9..."L{..
        0x0020:  0080 8800                                ....
```

**Comment by dashesy** [comment]
So your IP address on that NIC is `192.168.137.47` and that is what you should use for `client-addr` in cbmex (this is the address it binds to), you should not change the rest of the parameters I think.

**Comment by zeeMonkeez** [comment]
That's what I tried at first. When that didn't work, I found issues https://github.com/dashesy/CereLink/issues/16, https://github.com/dashesy/CereLink/issues/8 that suggested to change the binding address, but it does not work for me.

**Comment by dashesy** [comment]
I think it is best to first make it work with `nPlayServer` then look at NSP. I can test `nPlayServer` in a VM, but I do not have NSP. It might be an ARM thing, if that is the case I can at least figure out. 
P.S. it is possible for nPlayServer to transmit from one machine to another, so I will need to have a guest ARM even no need for nPlayServer to be compiled against ARM.

**Comment by zeeMonkeez** [comment]
Well, I did test `nPlayServer` running on the Windows machine, and `testcbsdk` connected successfully to that.

**Comment by dashesy** [comment]
You ran `testcbsdk` on Linux and `nPlayServer` on Windows (because you can)?

**Comment by zeeMonkeez** [comment]
Yes. Is that not worthwhile? It seemed to show that 1) UDP traffic gets across network and 2) `testcbsdk` is configured correctly and works.

**Comment by dashesy** [comment]
Oh yes it is! so the remaining problem seems to be the broadcast address. There might be a setting in the network card (that disables receiving broadcasts), otherwise in Linux it is odd. Do you capture any packets from NSP? how do they look?

**Comment by zeeMonkeez** [comment]
Packets from the NSP come through. This is the start of one:
```
02:16:15.965976 IP 192.168.137.128.51001 > 192.168.137.255.51002: UDP, length 120
        0x0000:  4500 0094 8aea 4000 4011 1a9e c0a8 8980  E.....@.@.......
        0x0010:  c0a8 89ff c739 c73a 0080 dd78 a412 d602  .....9.:...x....
```
Here is another:
```
02:16:15.966297 IP 192.168.137.128.51001 > 192.168.137.255.51002: UDP, length 1440
        0x0000:  4500 05bc 8aeb 4000 4011 1575 c0a8 8980  E.....@.@..u....
        0x0010:  c0a8 89ff c739 c73a 05a8 402c be12 d602  .....9.:..@,....
```
and so on, every millisecond or so
```
02:16:15.967084 IP 192.168.137.128.51001 > 192.168.137.255.51002: UDP, length 1080
        0x0000:  4500 0454 8aec 4000 4011 16dc c0a8 8980  E..T..@.@.......
        0x0010:  c0a8 89ff c739 c73a 0440 d061 bf12 d602  .....9.:.@.a....
```

**Comment by dashesy** [comment]
one more question, how many network cards do you have, if you have another one what is its `ifconfig`

**Comment by zeeMonkeez** [comment]
There is a WiFi adapter.
```
wlan0     Link encap:Ethernet  HWaddr xxxxxxx  
          inet addr:10.3.7.181  Bcast:10.3.15.255  Mask:255.255.240.0
          inet6 addr: xxxxxxx/64 Scope:Link
          UP BROADCAST RUNNING MULTICAST  MTU:1500  Metric:1
          RX packets:278236 errors:0 dropped:5151 overruns:0 frame:0
          TX packets:38257 errors:0 dropped:9 overruns:0 carrier:0
          collisions:0 txqueuelen:1000 
          RX bytes:232296418 (232.2 MB)  TX bytes:35177178 (35.1 MB)
```

**Comment by dashesy** [comment]
That is on a different subnet. I checked in some code, can you pull and see if it helps (please test 255.255.255.255 as well as 192.168.137.255)

**Comment by zeeMonkeez** [comment]
I tested both. With `255.255.255.255`, there is some back and forth:
```
06:33:21.562282 IP 192.168.137.47.51002 > 192.168.137.128.51001: UDP, length 32
        0x0000:  4500 003c ba03 4000 4011 ecac c0a8 892f  E..<..@.@....../
        0x0010:  c0a8 8980 c73a c739 0028 943a 0100 0000  .....:.9.(.:....
        0x0020:  0080 9206 0800 0000 107f 0100 0000 0000  ................
        0x0030:  0000 0000 3200 0000 0000 0000            ....2.......
06:33:21.562535 IP 192.168.137.128.51001 > 192.168.137.255.51002: UDP, length 32
        0x0000:  4500 003c c7c5 4000 4011 de1a c0a8 8980  E..<..@.@.......
        0x0010:  c0a8 89ff c739 c73a 0028 415d 0000 0000  .....9.:.(A]....
        0x0020:  0080 1206 3075 0000 3000 0000 0a00 0000  ....0u..0.......
        0x0030:  0000 0000 1e00 0000 0000 0000            ............
06:33:21.712221 IP 192.168.137.47.51002 > 192.168.137.128.51001: UDP, length 32
        0x0000:  4500 003c ba12 4000 4011 ec9d c0a8 892f  E..<..@.@....../
        0x0010:  c0a8 8980 c73a c739 0028 943a 0100 0000  .....:.9.(.:....
        0x0020:  0080 9206 0800 0000 107f 0100 0000 0000  ................
        0x0030:  0000 0000 3200 0000 0000 0000            ....2.......
06:33:21.712392 IP 192.168.137.128.51001 > 192.168.137.255.51002: UDP, length 32
        0x0000:  4500 003c c7c6 4000 4011 de19 c0a8 8980  E..<..@.@.......
        0x0010:  c0a8 89ff c739 c73a 0028 415d 0000 0000  .....9.:.(A]....
        0x0020:  0080 1206 3075 0000 3000 0000 0a00 0000  ....0u..0.......
        0x0030:  0000 0000 1e00 0000 0000 0000            ............
06:33:21.862223 IP 192.168.137.47.51002 > 192.168.137.128.51001: UDP, length 32
        0x0000:  4500 003c ba14 4000 4011 ec9b c0a8 892f  E..<..@.@....../
        0x0010:  c0a8 8980 c73a c739 0028 943a 0100 0000  .....:.9.(.:....
        0x0020:  0080 9206 0800 0000 107f 0100 0000 0000  ................
        0x0030:  0000 0000 3200 0000 0000 0000            ....2.......
06:33:21.862410 IP 192.168.137.128.51001 > 192.168.137.255.51002: UDP, length 32
        0x0000:  4500 003c c7c7 4000 4011 de18 c0a8 8980  E..<..@.@.......
        0x0010:  c0a8 89ff c739 c73a 0028 415d 0000 0000  .....9.:.(A]....
        0x0020:  0080 1206 3075 0000 3000 0000 0a00 0000  ....0u..0.......
        0x0030:  0000 0000 1e00 0000 0000 0000            ............
06:33:22.012219 IP 192.168.137.47.51002 > 192.168.137.128.51001: UDP, length 32
        0x0000:  4500 003c ba1a 4000 4011 ec95 c0a8 892f  E..<..@.@....../
        0x0010:  c0a8 8980 c73a c739 0028 943a 0100 0000  .....:.9.(.:....
        0x0020:  0080 9206 0800 0000 107f 0100 0000 0000  ................
        0x0030:  0000 0000 3200 0000 0000 0000            ....2.......
06:33:22.012427 IP 192.168.137.128.51001 > 192.168.137.255.51002: UDP, length 32
        0x0000:  4500 003c c7c8 4000 4011 de17 c0a8 8980  E..<..@.@.......
        0x0010:  c0a8 89ff c739 c73a 0028 415d 0000 0000  .....9.:.(A]....
        0x0020:  0080 1206 3075 0000 3000 0000 0a00 0000  ....0u..0.......
        0x0030:  0000 0000 1e00 0000 0000 0000            ............
```
Then the NSP sends out its configuration:
```
06:33:22.552597 IP 192.168.137.128.51001 > 192.168.137.255.51002: UDP, length 1420
        0x0000:  4500 05a8 c7d4 4000 4011 d89f c0a8 8980  E.....@.@.......
        0x0010:  c0a8 89ff c739 c73a 0594 d688 0000 0000  .....9.:........
        0x0020:  0080 0800 0000 0000 0080 211c 0100 0000  ..........!.....
        0x0030:  0604 0000 3132 382d 4368 616e 6e65 6c20  ....128-Channel.
        0x0040:  4e53 5031 2e30 2077 6974 6820 4578 7065  NSP1.0.with.Expe
        0x0050:  7269 6d65 6e74 2049 2f4f 0000 0000 0000  riment.I/O......
        0x0060:  0000 0000 0000 0000 0000 0000 0000 0000  ................
```
After about 200 packets, it stops and `testcbsdk` exits with error code -30 (offline).

Using `192.168.137.255`, there is less back and forth before the NSP sends its configuration:
```
06:35:36.022879 IP 192.168.137.47.51002 > 192.168.137.128.51001: UDP, length 32
        0x0000:  4500 003c cc3d 4000 4011 da72 c0a8 892f  E..<.=@.@..r.../
        0x0010:  c0a8 8980 c73a c739 0028 943a 0100 0000  .....:.9.(.:....
        0x0020:  0080 9206 0800 0000 107f 0100 0000 0000  ................
        0x0030:  0000 0000 3200 0000 0000 0000            ....2.......
06:35:36.023085 IP 192.168.137.128.51001 > 192.168.137.255.51002: UDP, length 32
        0x0000:  4500 003c fae1 4000 4011 aafe c0a8 8980  E..<..@.@.......
        0x0010:  c0a8 89ff c739 c73a 0028 415d 0000 0000  .....9.:.(A]....
        0x0020:  0080 1206 3075 0000 3000 0000 0a00 0000  ....0u..0.......
        0x0030:  0000 0000 1e00 0000 0000 0000            ............
06:35:36.512838 IP 192.168.137.47.51002 > 192.168.137.128.51001: UDP, length 32
        0x0000:  4500 003c cc6c 4000 4011 da43 c0a8 892f  E..<.l@.@..C.../
        0x0010:  c0a8 8980 c73a c739 0028 943a 0100 0000  .....:.9.(.:....
        0x0020:  0080 9206 0900 0000 107f 0100 0000 0000  ................
        0x0030:  0000 0000 1400 0000 0000 0000            ............
06:35:36.513081 IP 192.168.137.128.51001 > 192.168.137.255.51002: UDP, length 32
        0x0000:  4500 003c fae2 4000 4011 aafd c0a8 8980  E..<..@.@.......
        0x0010:  c0a8 89ff c739 c73a 0028 4b5d 0000 0000  .....9.:.(K]....
        0x0020:  0080 1206 3075 0000 3000 0000 0a00 0000  ....0u..0.......
        0x0030:  0000 0000 1400 0000 0000 0000            ............
06:35:36.551328 IP 192.168.137.128.51001 > 192.168.137.255.51002: UDP, length 32
        0x0000:  4500 003c fae3 4000 4011 aafc c0a8 8980  E..<..@.@.......
        0x0010:  c0a8 89ff c739 c73a 0028 415d 0000 0000  .....9.:.(A]....
        0x0020:  0080 1206 3075 0000 3000 0000 0a00 0000  ....0u..0.......
        0x0030:  0000 0000 1e00 0000 0000 0000            ............
06:35:37.012828 IP 192.168.137.47.51002 > 192.168.137.128.51001: UDP, length 8
        0x0000:  4500 0024 cc9a 4000 4011 da2d c0a8 892f  E..$..@.@..-.../
        0x0010:  c0a8 8980 c73a c739 0010 9422 0100 0000  .....:.9..."....
        0x0020:  0080 8800                                ....
06:35:37.013149 IP 192.168.137.128.51001 > 192.168.137.255.51002: UDP, length 1420
        0x0000:  4500 05a8 fae4 4000 4011 a58f c0a8 8980  E.....@.@.......
        0x0010:  c0a8 89ff c739 c73a 0594 d688 0000 0000  .....9.:........
        0x0020:  0080 0800 0000 0000 0080 211c 0100 0000  ..........!.....
        0x0030:  0604 0000 3132 382d 4368 616e 6e65 6c20  ....128-Channel.
        0x0040:  4e53 5031 2e30 2077 6974 6820 4578 7065  NSP1.0.with.Expe
        0x0050:  7269 6d65 6e74 2049 2f4f 0000 0000 0000  riment.I/O......
        0x0060:  0000 0000 0000 0000 0000 0000 0000 0000  ................
```
It then continues to send out data, however, after some time, `tescbsdk` exits with -28 (timeout).

**Comment by dashesy** [comment]
That it sends the configuration means connection established. Why it times out I have to look again. Also if I am correct you do not need to set either one of them. Have you done this: `sudo sysctl -w net.core.rmem_max=8388608`? need lots of buffer

**Comment by zeeMonkeez** [comment]
The buffer by default is even larger on this system: `net.core.rmem_max = 26214400`.

**Comment by dashesy** [comment]
I increased timeout (please pull) to see if it is that simple. How many channels do you have?

**Comment by zeeMonkeez** [comment]
That didn't help. Initial tests were with 128 channels @ 30kHz, later with 96 (because of the experiments running normally), and now I tested with one channel streaming raw + 1kHz.

**Comment by zeeMonkeez** [comment]
I added some debug output to `SdkApp::OnInstNetworkEvent`. I get `NET_EVENT_INIT`, `NET_EVENT_NETSTANDALONE`, `NET_EVENT_INSTCONNECTING`, `NET_EVENT_INSTCONFIG`, then after a while `NET_EVENT_INSTRUN`, then timeout occurs (I set it to 40s), and finally `NET_EVENT_CLOSE`.
Any deep debugging I can help with?

**Comment by dashesy** [comment]
This is a bug, the fact that it gets instinfo means all is well, but is not signaled. Will have a look tomorrow, what I do not get is why this only shows when it comes from NSP but not nPlay.

**Comment by zeeMonkeez** [comment]
Sorry if I wasn't clear, `NET_EVENT_INSTINFO` actually does not get triggered, what I wrote above was just my observation from the source (it expects a `cbPKTTYPE_SYSREP` to trigger).

**Comment by dashesy** [comment]
`cbPKTTYPE_SYSREP` is supposed to be the last in the initial configuration packets, if it is lost I think some configurations also could have been lost. On a system that CereLink does not time out, if you capture packets (Wireshark) you will see `cbPKTTYPE_SYSREP` after all the configs, you can connect 1 Linux and 1 Windows system (then e.g. initiate on Linux) and capture the incoming packets in passive mode to see if there is any discrepancy. I have seen this when a router drops udp packets, or does not have priority queues, but you do not have a router so it might be the network adapter.

**Comment by zeeMonkeez** [comment]
So if I'm not mistaken, the packet type should be byte 14 of the UDP packet (there are 8 bytes in the UDP header, another 4 bytes for the timestamp, and 2 bytes for channel ID) . If I filter the network traffic on the Windows machine while starting or resetting Central/the NSP, I never get `0x10 == cbPKTTYPE_SYSREP` as byte 14. I do get `0x12` and all the others. Here is what I used to capture UDP traffic:
```
WinDump.exe -c 1 -s 192 -l -x "udp[14] == 0x10"
```
Just to positively confirm, Central reports 6.04, hwlib 3.09, NSP w/firmware 6.04

**Comment by dashesy** [comment]
Are you sure there is no 6.04.2 or something (can you ask Blackrock support)? I just checked `cbPKTTYPE_SYSREP` should be transmitted after all packets when configuration is requested (which is what happens when first we connect). [Here](https://github.com/dashesy/CereLink/blob/master/cbhwlib/InstNetwork.cpp#L494) we request it with `cbPKTTYPE_REQCONFIGALL`. Maybe [here](https://github.com/dashesy/CereLink/blob/master/cbhwlib/InstNetwork.cpp#L505) 200 is increased to 300 it could avoid possibility of rebooting in the middle of config. I am just speculating.

**Comment by zeeMonkeez** [comment]
I sent an email to Nick, to see what he says. Meanwhile, here are the packets Central sends out on my Windows PC during startup:
```
15:32:58.208022 IP Cerebus1.51002 > 192.168.137.128.51001: UDP, length 32
        0x0000:  4500 003c 0eb7 0000 8011 0000 c0a8 8902
        0x0010:  c0a8 8980 c73a c739 0028 940d 0100 0000
        0x0020:  0080 9206 0100 0000 aa3b b175 94f7 1800
        0x0030:  0000 0000 3200 0000 0000 0000
15:32:58.600692 IP Cerebus1.137 > 192.168.137.128.137: UDP, length 50
        0x0000:  4500 004e 0eb8 0000 8011 0000 c0a8 8902
        0x0010:  c0a8 8980 0089 0089 003a 941f 8b5c 0000
        0x0020:  0001 0000 0000 0000 2043 4b41 4141 4141
        0x0030:  4141 4141 4141 4141 4141 4141 4141 4141
        0x0040:  4141 4141 4141 4141 4100 0021 0001
15:32:58.681032 IP Cerebus1.51002 > 192.168.137.128.51001: UDP, length 32
        0x0000:  4500 003c 0eb9 0000 8011 0000 c0a8 8902
        0x0010:  c0a8 8980 c73a c739 0028 940d 0100 0000
        0x0020:  0080 9206 0100 0000 aa3b b175 94f7 1800
        0x0030:  0000 0000 1400 0000 0000 0000
15:32:59.181020 IP Cerebus1.51002 > 192.168.137.128.51001: UDP, length 8
        0x0000:  4500 0024 0eba 0000 8011 0000 c0a8 8902
        0x0010:  c0a8 8980 c73a c739 0010 93f5 0100 0000
        0x0020:  0080 8800
15:33:00.099926 IP Cerebus1.137 > 192.168.137.128.137: UDP, length 50
        0x0000:  4500 004e 0ebb 0000 8011 0000 c0a8 8902
        0x0010:  c0a8 8980 0089 0089 003a 941f 8b5c 0000
        0x0020:  0001 0000 0000 0000 2043 4b41 4141 4141
        0x0030:  4141 4141 4141 4141 4141 4141 4141 4141
        0x0040:  4141 4141 4141 4141 4100 0021 0001
15:33:00.181346 IP Cerebus1.51002 > 192.168.137.128.51001: UDP, length 32
        0x0000:  4500 003c 0ebc 0000 8011 0000 c0a8 8902
        0x0010:  c0a8 8980 c73a c739 0028 940d 0100 0000
        0x0020:  0080 9206 0100 0000 aa3b b175 94f7 1800
        0x0030:  0000 0000 2800 0000 0000 0000
15:33:01.599923 IP Cerebus1.137 > 192.168.137.128.137: UDP, length 50
        0x0000:  4500 004e 0ebd 0000 8011 0000 c0a8 8902
        0x0010:  c0a8 8980 0089 0089 003a 941f 8b5c 0000
        0x0020:  0001 0000 0000 0000 2043 4b41 4141 4141
        0x0030:  4141 4141 4141 4141 4141 4141 4141 4141
        0x0040:  4141 4141 4141 4141 4100 0021 0001
```

Whereas `testcbsdk` never gets past
```
05:06:11.991078 IP 192.168.137.47.51002 > 192.168.137.128.51001: UDP, length 32
        0x0000:  4500 003c a13b 4000 4011 0575 c0a8 892f  E..<.;@.@..u.../
        0x0010:  c0a8 8980 c73a c739 0028 943a 0100 0000  .....:.9.(.:....
        0x0020:  0080 9206 0800 0000 107f 0100 1089 e1b4  ................
        0x0030:  0000 0000 3200 0000 0000 0000            ....2.......
05:06:12.980866 IP 192.168.137.47.51002 > 192.168.137.128.51001: UDP, length 8
        0x0000:  4500 0024 a16b 4000 4011 055d c0a8 892f  E..$.k@.@..].../
        0x0010:  c0a8 8980 c73a c739 0010 9422 9ef5 5b00  .....:.9..."..[.
        0x0020:  0080 8800                                ....
```

**Comment by zeeMonkeez** [comment]
I've set the `if`s [here] (https://github.com/dashesy/CereLink/blob/master/cbhwlib/InstNetwork.cpp#L487) and [here] (https://github.com/dashesy/CereLink/blob/master/cbhwlib/InstNetwork.cpp#L509) to always true, but that does not change anything (other than the respective packets being fired).

**Comment by zeeMonkeez** [comment]
Just installed Central 6.05.02 (and NSP firmware 6.05.01). While there is communication between `testcbsdk` and the NSP, there is still no successful connection. But then again, `cbhwlib` and `cbSDK` sources in this repo aren't up to date. Asked Blackrock for latest sources, waiting for response.

**Comment by dashesy** [comment]
If we are lucky only `cbhwlib.cpp` and `cbhwlib.h` have changed (in backward compatible way)

**Comment by zeeMonkeez** [comment]
Where is the order of packets to be sent/received defined?

**Comment by dashesy** [comment]
It is [here](https://github.com/dashesy/CereLink/blob/master/cbhwlib/InstNetwork.cpp#L473). Sorry, but I will not be able to assist you for few weeks (too busy) and besides I can only debug with `nPlayServer`. I wish BlackRock was more involved and would at least test with NSP and in your flavor of Linux.

**Comment by zeeMonkeez** [comment]
I understand where in the code it is. But where does the specification come from?
Thanks for your help.

**Comment by dashesy** [comment]
The specification is clear if you also look at NSP code, but that is closed source. I have to get permission from Blackrock, or if you get permission for me I can send you a code (that I have permission just so I can test cbsdk with nPlayServer). 
I am at lost here why you do not get the packet only in NSP mode because NSP and nPlayServer both are exactly the same code (actually I ported NSP code to run on desktop). Have you tried to run it on a non-arm Linux (or on a different NIC)? I know at least one recent customer who is running it on Linux successfully, so am inclined to believe it could be that there is something ARM related. I have never tested `cbsdk` with ARM, and am sure there are shortcuts that are made that have different semantics on ARM (threading, ...). 
I plan to do a test on VM, but unfortunately have some work-related things I have to sort out first.

**Comment by FloFra** [comment]
Just for you information: This version CereLink is only compatible with hwlib 3.9 which is the hwlib used to compile Central v6.04 and the corresponding firmware. Central v6.05 is based on hwlib 3.10, so using it with CereLink will cause some problems, e.g. with channel information being corrupted.

Blackrock has already begun shipping v6.05 while so far denying us access to the source of the new version, so I can not tell you for sure if the new version has anything to do with your issues. I still think a downgrade is worth a try.

**Comment by dashesy** [comment]
I have requested for the latest protocol header files, will be updating it as soon as I get them

**Comment by dashesy** [comment]
I checked in some code that should fix `timeout` for some cases, please feel free to open another issue if problem persists.
